Date,Combined_News
2019-09-06,"Market watch: KSE-100 inches up amid thin trading,?Govt making all-out efforts to revive textile sector?,Proposal to set up CPEC authority opposed,Rupee likely to depreciate in next 6 months: SBP survey,'Pakistan can increase IT exports by training youth',Cabinet Division settles dispute over mandate of Electric Vehicle Policy,PTI govt, stakeholders at odds over cotton support price, Benchmark index rises 252.43 points to settle at 30,467.2,PM aide says steps are being taken to attract foreign, domestic investment,Parliamentary body terms it unnecessary, criticises decision to create it through a presidential ordinance,Report highlights balance of payment pressures as key risk,Official stresses forming companies as they are more trusted than individuals,Says industrial policy does not relate to climate change ministry,Differences also persist on giving tax incentives to agriculture sector"
2019-09-07,"Big Oil undermines UN climate goals with new projects: report,PM chairs meeting for workers? rights,PM assures textile delegation of promoting sector,SNGPL to start fresh process for post of managing director,OGRA reduces RLNG prices for September,?Further taxes will be detrimental to economy?,Italian companies encouraged to invest in energy sector,Talks between FBR and traders fail again,Riyadh to expedite work on $20b investment package,Punjab takes measures to boost private sector participation, Investment plans by Shell, BP and ExxonMobil will not be compatible with 2015 Paris Agreement,Meeting's focus was on ease of doing business ,favourable environment and strategic measures could increase exports of this sector up to $40 billion by 2030,Since March, this will be third attempt to advertise for the position,Slashes rates by 8.52% for SNGPL and 8.8% for SSGC consumers,Official urges govt to refrain from anti-business and anti-industry moves,Special assistant to PM on petroleum assures complete cooperation and facilitation,Traders refuse to become part of formal economy, which may jeopardise govt plan,Saudi official says there is resolve to show tangible results before Supreme Coordination Council moot,Governor promulgates Public-Private Partnership Ordinance 2019 for development of province"
2019-09-08,"0.3m tonnes of wheat in Sindh devoured by rats,US states launch antitrust probes of tech companies,PTI govt restores old gas tariffs for Tandoors,US-China trade conflict could take years to resolve: Kudlow,Canada challenges China?s canola ban at WTO,?China plans to invest $1b in development projects in Pakistan?,Pakistani team leaves for Bangkok for FATF talks,Legal formalities of defunct KASB Bank remain unfulfilled,'Tarbela Dam playing vital role for economic stability of Pakistan',Fertiliser price expected to rise by Rs200 per bag, Provincial govt has sought 0.4m tonnes of commodity from Passco,First investigation will focus on Facebook, second to centre on Google,A notification in this regard is expected to be issued by Oil and Gas Regulatory Authority (Ogra) shortly,Economic adviser confirms talks between high-level US, Chinese officials in early October
,Carr said in a statement that Ottawa was seeking bilateral consultations with China at the WTO,Envoy terms pace of development projects under CPEC as satisfactory,Final evaluation will decide whether country will stay on grey list or be blacklisted,Bank was handed over to BankIslami in May 2015 in return for Rs1,000 by SBP,WAPDA chairman says reservoir can still store more than six million acre feet water despite its life,Hike likely due to PTI govt's decision to withdraw GIDC ordinance"
2019-09-09,"Apple may spark upgrade rush with new iPhones, tight pricing,'Loopholes in tax form to make returns difficult',Pakistan seeks review in Reko Diq case,Amendments to Income Tax Ordinance 2001 proposed,CPEC?s second phase can put Pakistan's economy back on track,Emerging risks hamper growth of banking sector,Assessing new oil and gas sector policy steps,A surefire recipe for absorbing shocks,The curious case of CPEC Authority,PTI govt for promoting ?ease of doing business?: Firdous,FBR sets up RAC to boost exports, The California-based company is widely expected to launch three new iPhones on Tuesday,Experts say document includes certain parts pertaining to wealth reconciliation,Minister says country may face seizure of foreign assets if damages imposed,Move aimed at ensuring financial institutions submit annual reports before deadline
,It demands leading role of industrialist, private sector and business community

,This comes amid contraction in industries? growth, slowdown in economy,Govt seems to be active and on the right track in the energy sector,High forex reserves will help counter exchange rate shocks, control inflation,CPEC deals with complex interactions; there is little room for a central authority,SAPM on Information pins hope on task force established to boost textile sector,Makes additional collectors customs in-charge of the authority"
2019-09-10,"India, Nepal open South Asia's first cross-border oil pipeline,Indian Goldman executive 'stole millions' to pay poker debts,Khyber-Pakhtunkhwa: Rs133m worth mega project approved,EU studies reform of ?outdated? energy taxes,Oil rises as Saudi minister commits to output cuts,Pakistan can learn from China?s tech advances,Imran's govt urged to reshape economic policy,NAB probe deters investment in LNG market,Recent spell of rains: a blessing for rice farmers,World Bank rates progress on Dasu as 'moderately satisfactory',Farmers fear further decline in cotton production, The move is part of efforts to strengthen bilateral relations amid growing Chinese influence in landlocked nation
,Ashwani Jhunjhunwala swindled approximately $5.3m wired money to China,The approval was given by Provincial Working Development Party (PWDP) after it was pending for the last three years,Aims to align them with climate targets and changes in energy policy,Prince Abdulaziz says pillars of Saudi policy will not change and OPEC+ deal will survive,Pakistan needs to initiate some key measures in policymaking to avail benefits,Official says stakeholders should be consulted in policy making,Two global LNG suppliers stay away from bid to procure 200mmcfd,Have helped overcome water shortfall, aided in good rice yield,Meanwhile, PTI govt struggles to end five-year old dispute over land acquisition,Growers shift to sowing sugarcane, wheat due to guarantee of minimum support price"
2019-09-11,"Facilitating traders among top priorities: PM,Market watch: KSE-100 rises on expectations over FATF meeting,China exempts some US goods from retaliatory tariffs as fresh talks loom,Oil prices gain after US inventories fall,Hong Kong Exchanges proposes $39 billion London Stock Exchange takeover,Oil prices gain after bigger-than-expected fall in US stockpiles,White House adviser plays down expectations for US-China talks,US Census data shows women gained in income and jobs in 2018, Imran orders early completion of special economic zones in K-P, Punjab,Benchmark index gains 487.63 points to settle at 30,954.83,Goods include anti-cancer drugs, lubricants and animal feed ingredients,Prices have risen more than 7% this month, supported by declines in global inventories,Hong Kong Exchanges already has a base in London as an owner of the London Metal Exchange,US crude stockpiles fell last week by more than twice the amount,We really have to let the process take its course, says Peter Navarro,Poverty rate for women fell to 12.9 per cent in 2018 from 13.6 per cent in 2017"
2019-09-12,"PM Imran agrees to declare construction sector an industry,Parliamentary panel for shutting down PSM, USC,As trade talks loom, Chinese firms look into buying US farm goods,Foreign exchange: SBP reserves jump $182m to $8.46b,US briefly overtakes Saudi Arabia as top oil exporter: IEA,Market watch: KSE-100 soars on expectations of interest rate cut,Johnson vows UK will be ready for no-deal Brexit,Karachi-Gwadar-Gulf container line launched,Russian firm shows interest in Pakistan's electric vehicles industry,'GIDC being exploited for political gains',Cabinet poised to approve CPEC Authority ordinance,Pakistan?s fate at FATF still hangs in balance,Senate body stresses on eliminating double taxation,Pakistan govt meets IMF's tariff, social safety conditions, Says facilitating business community his govt?s first priority,PAC sub-committee expresses concerns over massive dues accumulated by the two entities,Move comes days before planned meeting of US, Chinese negotiators in Washington,Central bank cites official inflows as reason for increase in reserves,Maintains growth estimate for global oil demand at 1.1 million bpd in 2019,Benchmark index gains 591.78 points to settle at 31,546.61,Insists govt has been massively accelerating preparations for leaving European Union,Container line service is an integral part of the China-Pakistan Economic Corridor (CPEC), says the statement,Company executives call on PM aide to discuss nanotube technology
,Regrets withdrawal of ordinance will affect industrial production,Will meet next week to consider summary seeking promulgation of ordinance,More work needed on most critical indicators of terror financing probe, prosecution,Members call for focus on easing matters for investors, businessmen,Hikes power tariffs, makes one-off payments to over 5m BISP beneficiaries"
2019-09-13,"Pakistan needs to mobilise domestic tax revenue: IMF,China lifts investment quota for foreign investors,London Stock Exchange rejects Hong Kong's $39b takeover offer,Market watch: KSE-100 sheds 65 points in range bound trading,Google agrees ?945m tax settlement with France,Oil slips towards $60 on demand worries despite trade hopes,Car dealers threaten to go on strike in Lahore,Pakistan's marble sector declining due to lack of attention,Auto sales plummet 41% in August,Pakistan may face serious financing issues: Moody?s,PTI govt to open commercial section at Pakistan embassy in Ethiopia,Pakistan likely to miss IMF's tax refund condition, Spokesperson says global lender?s team will visit Islamabad in a few days,Move will give fresh impetus to financial reforms, opening-up drive,Tells HKEX it has fundamental concerns about key aspects of proposal,Benchmark index loses 0.21% to settle at 31,481.31,Google agrees ?945m tax settlement with France,Oil holds around $60 as U.S.-China trade hopes support,Demand solution to problems related to different taxation measures and imported vehicles,Has potential to provide countless opportunities for investment, employment,Downward trend comes on back of rupee devaluation, slowdown in economy,Says country will see significant deterioration in interest payments-to-revenue ratio,Move aimed at developing linkages between businesses of two countries,This comes despite IMF incentive of softening primary deficit target"
2019-09-14,"Protests against German car industry rev up,Pound jumps on Brexit hopes as global stocks firm,Inter-Bank Market: Rupee strengthens against dollar,President Alvi assures businessmen of taking up issues,Despite court?s ruling, dual nationals hold key posts in SNGPL,Remittances dive 17% after Eid boost,IESCO collects millions of rupees through fake bills,Govt misses deadlines to put CPEC projects on track,Domestic cement sales drop 5.5% in Jul-Aug, Pressure mounting on auto sector to go green, abandon combustion engines,Markets win support after China exempts some US products from added tariffs,The rupee strengthened against the dollar at Rs156.1/156.6,Says current account deficit is narrowing due to fall in imports, increase in exports,Board chairman says company secretary needs to put matter for discussion,Overseas Pakistanis send home $1.7b in Aug 2019,CEO admits fraud by company staff in Senate panel meeting,China expresses resolve to remain committed to multibillion-dollar project,Exports, however, post healthy increase of 12.7%"
2019-09-15,"PM seeks out-of-box economic solutions,PayPal cautious about Libra?s future,Weekly review: KSE-100 advances for second straight week,?Power tariff raised by 70% for Punjab exporters?,Federal govt's debt jumps to Rs33 trillion by July-end,Analysts expect SBP to keep rate unchanged,Track system for cigarette firms feared to face more delay, PM Imran directs ministries to work out roadmap to achieve targets,As International outcry mounts over Facebook?s upstart cryptocurrency,Benchmark index gains 3.3% largely due to expectations of monetary policy easing,Taxes push electricity cost to Rs20 per unit from earlier Rs10.62,Centre adds Rs1.23 trillion to debt level in just one month,Anticipation comes due to lower-than-expected inflation reading for Aug,Deadline for submitting EOIs for installing system likely to be extended"
2019-09-16,"SBP retains interest rate at 13.25% for next two months,POL prices in Pakistan likely to go up after attacks on Saudi oil plants,Market watch: KSE-100 rallies on back of surge in global oil prices,Iran seizes vessel in Gulf for 'smuggling diesel fuel to UAE',Monetary policy: SBP leaves interest rate unchanged at 13.25%,Saudi on track to restore third of lost oil output: experts,Oil prices rocket on slashed Saudi output,As tensions escalate in Middle East, Pakistan?s energy supply at risk,Global Liveability Index - what can we learn?,Higher revenues in midst of recession quite challenging,Free trade - are MNCs driving local firms out of business?,Rate hikes, rupee fall to have serious social impact in Pakistan,PTI govt eyes Rs1tr non-tax revenue next year,Ministries directed to submit report on IMF targets, Central bank has kept its projection for inflation unchanged at 11-12% for full fiscal year 2020,Pakistan?s energy supply is also at a risk due to mounted tensions in Middle East and South Asia,Benchmark index increases 447.24 points to settle at 31,928.55,Iran stepped up its fight against smuggling fuel earlier this month ,Announcement largely in line with market expectations,Drone attacks on two major oil facilities,Price increase weighs across global stock markets on fears of impact on global growth,Govt needs to take urgent steps for developing strategic oil, gas storages,Karachi fares poorly on index mainly due to stability and environment factors

,Increase in number of tax return filers will not push up revenue receipts
,Free trade not only brings goods and services, it also brings new knowledge,Despite SBP assurances, long-term effect of IMF deal is yet to be seen,Finance adviser says Pakistan fast heading towards economic stability,Sources say since many of conditions agreed with international money lender could not be fulfilled"
2019-09-17,"Petroleum ministry unable to recover Rs7.5b dues from Byco,China, UAE hold talks on CPEC investment,KAPCO's profit surges 23.5% to Rs13.1b,Stocks end in red amid mixed trading,Trump says initial tariff deal agreed with Japan,Oil sinks 5% on forecasts of quick Saudi output recovery,Trade talks seen as unlikely to mend US-China divide,PTI govt set to launch 13 mega agri-projects,DG Khan Cement?s profit plunges 79%,PTA hopes 5G will be available by 2021,Pakistan's power sector has $80b investment potential,PTI govt plans to abolish 3% VAT on 32 goods,Pakistan targets five countries for greater market access,'CPEC projects completed or near completion', AAG Rehman has sought one month?s time from apex court to resolve the matter,Second and third phase schemes of the mega project discussed,Rise comes due to drop in cost of sales, surge in other income,Benchmark index decreases 19.63 points to settle at 31,908.92,Says further talks will be held with Japan to secure comprehensive agreement,Market already trading in negative territory after record gains fuelled by attacks on Saudi facilities,China?s Communist Party also faces a slowing economy as it prepares to celebrate 70 years of ruling on Oct 1,Sahibzada Muhammad Mehboob Sultan says joint venture with China will help efficiently tap resources,Board announces cash dividend of Re1 per share,Seeks two-month time for submitting complete plan for 5G launch
,Minister says scores of companies are interested in making investment,May also lower sales tax liabilities for car assemblers; move will hit FBR's tax revenues,Dawood says economy on right track as exports rise, imports fall,Yao says phase-I completion has set strong foundation for phase-II"
2019-09-18,"Market watch: Bourse turns bearish, sheds 353 points,Can Saudi Arabia's loss be US oil producers' gain?,New York Fed steps into market to move interest rates,cFrance sending experts to investigate Saudi oil attack: Elysee,PTA asks Zong to withdraw 5G advertisement,MNAs term IMF loan deal unrealistic, anti-poor,In Pakistan, smartphone market feels impact of rupee fall,IMF rules out revising programme targets,Trade between Pakistan, Uzbekistan doubles,Two options proposed for LNG plants' privatisation, Benchmark index decreases 1.11% to settle at 31,555.47,American petroleum producers seem neither ready, nor willing to fill void and capture market share,Emergency interventions come as sudden cash shortages drove up interest rates,Macron condemns the attack,Mobile operator not authorised to offer commercial services based on 5G,Question conditions imposed by lender, suggest adjustment of targets,Chinese firm considers setting up smartphone manufacturing facility in Pakistan,Global lender?s regional head says results encouraging so far, Pakistan needs to remain patient,Uzbekistan's city mayor calls for strengthening bilateral ties,Privatisation Commission suggests either privatise power plants as one unit or sell them separately"
2019-09-19,"NAB summons SECP commissioner, chairman in CSM case,Tough economic reforms bearing fruits, IMF told,OECD cuts global growth outlook to post-crisis low,US, Chinese trade deputies face off in Washington amid deep differences,Foreign exchange: SBP reserves jump $138m to $8.6b,Market watch: KSE-100 gains 629 points as bulls return,Oil prices rise as Saudi supply risks come into focus,As Amazon burns, 230 big investors call on firms to protect world's rainforests,Fact check: Pakistan does not import oil from Iran,ECC maintains ban on wheat export,K-Electric?s profit rises 18% on tariff increase,PTI govt announces incentives for shipping firms,FDI dips 58% to $156.7m despite signs of recovery,OGDC's profit surges 50% to Rs118b,Private sector firm inks LNG import deal with ExxonMobil,PTI govt gives nod to initiate privatisation process, Tahir Mahmood has been asked to appear before an investigation team on September 27, 2019,SBP assures fund's delegation of consistency in implementing reforms,Says global economy risks entering new, lasting low-growth phase,Negotiations aimed at laying groundwork for high-level talks in early October,Central bank cites no reason for increase,Benchmark index increases 1.99% to settle at 32,184.03,Attacks on Saudi oil sites knock down more than half of crude output,In Brazil alone, more 2,400 square miles of the Amazon has been deforested this year,Last time Pakistan imported diesel was a meager quantity of 1,000 tonnes in 2009,Approves transfer of Rs2b from parliamentarians? schemes to priority projects
,Company earns Rs12b as power sales go up in rupee terms,New companies will be exempt from taxes and duty,Investors hold back decision on investment in new projects,Earnings rise due to higher global oil and gas prices, rupee fall,As part of agreement, ExxonMobil of US will make investment in Pakistan,Will sell one dozen enterprises, approves transaction structure for LNG plants"
2019-09-20,"AGP finds irregularities of Rs307.57b in PSO affairs,Traders announce Islamabad march on Oct 9,Market watch: KSE-100 loses 73 points in volatile session,Oil heading for 7% weekly gain after Saudi attacks,Shell, Exxon Mobil among groups to build five LNG terminals,Investment policy conducive for business: Alvi,K-P govt secured Rs10.5b investment for industries,Dawood to discuss market access with US,World Bank to hold conference for fast digitalisation in Pakistan,US firms asked to explore investment avenues in Pakistan,Despite cabinet?s nod, govt fails to appoint ZTBL head,Current account deficit narrows 55% to $1.29b in Jul-Aug,Shale oil, gas exploration to begin in Sindh by year-end,FBR pulls plan for sales tax relief to car assemblers,Sales tax registration made compulsory for cotton traders, Company has failed to recover its dues from govt and private institutions,Negotiations over fixed tax scheme with FBR fail,Benchmark index decreases 0.23% to settle at 32,111.1,Aramco shipping equipment from US and Europe to rebuild damaged facilities,Petroleum ministerÿconfirms the terminals will be operational within two to three years,'this investment will help in the diversification of Japanese investment in Pakistan',Special Assistant to Khyber-Pakhtunkhwa (K-P) Chief Minister Abdul Karim says several sick units have been revived,Says America wants 10-15 times increase in trade with Pakistan,At present, Pakistan exports IT and software worth billions of dollars per year,Soomro highlights government efforts to lure foreign investment through one-window facility,Delay has affected bank?s performance as loan disbursement falls,Reading, however, is slightly higher than expected,OGDC will undertake pilot project keeping in view environmental standards,Withdraws summary seeking cabinet's approval to lower sales tax liabilities for auto sector,They are required to furnish details of purchases every month"
2019-09-21,"?Pakistan should not worry about currency devaluation?,Central and West Asia to jointly tackle energy challenges,Growth of LSM industries shrinks 3.3% in July,Inflation to remain high for two more years: SBP,NEPRA irked by 'NAB?s meddling' in tariff affairs,Govt plans to grant new petroleum exploration licences,Circular debt has dipped significantly, Omar Ayub tells IMF,Trade deficit contracts 36% to $3.9b in Jul-Aug FY20,IMF refuses to revise projections despite poor fiscal results, Embassy of Japan official says govt should focus on development to boost growth,Nine countries sign declaration to accelerate cross-border cooperation on energy issues,Central bank remains inflexible on monetary policy stance despite PM intervention,Special panel questions policy that is fuelling inflation instead of curbing it,Regulator complains the way investigations are being conducted has stifled morale of professionals,PM aide apprises Canadian firms of investment avenues in Pakistan,Fund chief appreciates efforts made by Power Division,Decline comes on back of 21% reduction in imports,Washington-based lender keeps 2.4% low GDP growth rate forecast"
2019-09-22,"Pakistan among countries where high spectrum costs lead to negative outcomes,Closer Sino-Russian ties to bring prosperity,Hopes fade as China cancels US farm visits,In IMF talks: Ukraine leader promises probe into banking abuses,KSE-100 index gains for third successive week,In Pakistan, e-commerce sector requires PTI govt's attention,Mango exports likely to surpass 120,000 tons,Pakistan gets $1.5b worth of foreign loans in Jul-Aug, GSMA report argues high costs restrict ability for network investment
,Both countries agree on deepening strategic communication,Chinese officials were expected to visit farmers as goodwill gesture,Visiting officials to discuss new loans-for-reforms programme,Uptrend in market comes on back of surge in global oil prices,Stakeholders demand ecosystem to curb bottlenecks, promote start-ups,Higher production, significant rupee fall help improve export volumes,Disbursements picking up following signing of IMF loan programme"
2019-09-23,"Careem fined for providing 'faulty' service,Market watch: KSE-100 dips further in absence of positive triggers,Oil falls below $64 on Saudi oil restart prospects, economic concerns,Banks launch framework to track carbon footprint of investments,Oil gains on Saudi supply disruption, Mideast tensions,World's oldest travel firm Thomas Cook goes bankrupt,Top auditor detects irregularities worth Rs97b in Pakistan Railways,Pakistan's GIDC controversy and solution thereof,In Pakistan, low export base restricts GSP Plus benefits,Tale of two nations: How Pakistan can learn from Greece?s turnaround?,For Pakistan, deficit reduction is a success but is not enough,Pakistan to float Eurobonds, Sukuk through MTN, Consumer court found the cab service guilty, imposed fine for causing mental distress to consumer,Benchmark index decreases 359.89 points to settle at 31,751.21,Saudi Arabia has restored around 75% of crude output lost in Sept 14 attack,Will assess and disclose impact their loans and investments will have on climate change , Oil prices rise to their highest in two sessions,Over half a million travellers stranded; UK to conduct largest peacetime repatriation effort in British history,Country?s top auditor has directed Railways authorities to take action against those found responsible,Levy should be abolished as it has not been utilised for designed purpose

,Exporters find it difficult to comply with stringent product, packaging standards,While reforms are changing Greece, Pakistan is still groping in dark
,Pakistan has compromised on many goals while narrowing current account gap,Ministry invites proposals from financial institutions for programme"
