Date,Combined_News
2019-03-15,"Market watch: KSE-100 dives 502 points as investors offload stocks,Oil retreats from 2019 high on soaring production,Indian PM Modi accused of tweaking, burying unwelcoming economic numbers,Govt, IMF yet to decide on bailout package: Asad Umar,Minister stresses higher number of women in workforce,?Faisalabad has potential to boost exports?,Interloop raises Rs5.032b from investors at Pakistan Stock Exchange,Pakistan to likely face another 41% hike in gas prices from July,World Bank?s report on Pakistan to be launched next week,ADB offers Pakistan to explore options of SME financing using local currency bonds,Pakistan govt fails to set tax recovery target for offshore accounts,No new mega projects in next year's PSDP, Benchmark index decreases 1.29% to settle at 38,306.95,Market torn between high US oil output and OPEC+ compliance with production cuts,Modi is vulnerable over his economic record in the polls starting on April 11,Finance minister says IMF mission chief arriving on March 26; APG delegation to visit on March 25,Addressing the delegates at the second day of ?Leaders in Islamabad Business Summit? conference,Former president of FPCCI says at the soft launch of Faisalabad Expo-2019,General public will be offered shares on March 21-22 at Rs46.10 per share
,Tariff increase proposed to meet revenue shortfall of gas utilities,Document will discuss options for increase in Pakistan?s economic growth,Adviser to PM meets ADB officials,ÿ discusses economic priorities,So far, only one person has paid tax out of the targeted 152,000 accounts,Planning ministry wants to spend over Rs1 trillion under PSDP every year for next five years"
2019-03-16,"FBR halts crackdown on tax payers with immediate effect,Govt for facilitating border trade with Iranÿ,SPI increases 0.19%ÿ,Rupee weakens against dollarÿ,Punjab to introduce Smart Regulations Act,Ministry launches data portal to transform energy market,Current account deficit declines 22.5% to $8.84b,BRI has growing impact on world: envoy,Pakistan lagging behind in sugarcane productivity,PM satisfied with aviation policy draft,Another power tariff hike on the cards,Senate panel recommends Rs200b GIDC recovery in six installments,FDI drops 23% after completion of many CPEC projects,Govt fails to frame strategy for manpower export,Pakistan seeks $500 million loan from ADB, Authority chairman informs business community they will not conduct raids,The meeting agreed to address the obstacles being faced by the two countries in the area of trade,During the week, average prices of 23 items rose in a selected basket of goods,Cumulatively, the rupee has lost 31.8% of its value in the last 13 mont,Minister says clubbing of taxes, inspection-free system discussed with PM,Current single buyer/seller model will turn into wholesale market,Drop due to rise in remittances, fall in services import,Says energy crisis afflicting Pakistan has largely subsided due to CPEC,UAF VC stresses need for mechanising the agriculture sector,Instructs aviation department to put it up for approval in next cabinet meeting,Users to face over Rs3 per unit rise in electricity prices,Minister admits application of wrong pressure factor inflated consumer bills,Amounts to just $1.62b in Jul-Feb of current fiscal year,Labour export has dropped in past three years; remittances unlikely to get boost,Plans to request IMF to send a staff level mission next month"
2019-03-17,"Malaysia threatens WTO case over dropping biofuel,ICCI alarmed at drop in investment,Trade war cost US economy $7.8 billion in 2018: study,Govt sets aside Rs43.7b to secure Afghan border,Pakistan needs to polish its labour force for Gulf states,Weekly review: KSE-100 slides for sixth successive week, loses 643 points,Government to announce trade policy soon,FBR to digitalise tax collection system, European Commission says palm oil cultivation results in deforestation,'It is high time the government take measures to create conducive environment for investors',Authors say they found that imports from targeted countries declined,Funds to be used to enhance capacity of forces manning western frontier

,A targeted approach focused on high growth sectors required,Concern over IMF, hike in gas prices and economic developments keeps investors away,Adviser stresses need for exploring new sectors and markets to boost exports,It will detect tax evasion, end corruption and harassment of taxpayers"
2019-03-18,"Market watch: Bulls dominate as KSE-100 surges 545 points,OPEC to scrap April meeting but keep oil cuts in place,Pakistan needs faster reforms, deep-rooted economic transformation: World Bank,Policymakers need to frame laws to create level playing field for women,Pakistan should leverage CPEC, GSP Plus  to attract investment,Coal share in electricity production may reach 18%,For boosting exports, Pakistan must conduct deep study of Saudi Arabian market,Sooner or later, country will need IMF programme, Benchmark index increases 1.42% to settle at 38,851.95,Saudi energy minister says April would be too early for any decision on output policy ,Focusing on Pakistan in 2047, new WB report recommends reforms to accelerate and sustain growth,Participation of women is exceedingly important in economic growth

,Investors require competitive business environment, safeguarded from uncertainties 
such as war

,Globally coal-fired capacity is constantly being replaced with cleaner sources 
,There are many opportunities for raising shipments; so far trade balance is highly tilted in favour of the kingdom

,Time will tell whether the government is able to solve structural problems to correct balance of payments"
2019-03-19,"Oil prices rise to 2019 highs on OPEC cuts, US sanctions,Thar coal starts power supply to national grid,ADB approves $9m financing for K-P projects,Apple building first data centre in north China,Govt selection bodies may replace boards of state units,Tajikistan wants to take bilateral trade with Pakistan to $500m,PTI govt aims to develop 50 intermediate cities: Bakhtyar,Pakistan to start producing power from Thar coal in few days,PTI govt promises equal incentives for local, foreign investors in Pakistan,Ahead of IMF mission's visit, Pakistani rupee hits all-time low at 139.4 against US dollar,World Bank sees Pakistan's potential to be a $2 trillion economy,Over 150,000 Pakistanis have $11 billion in offshore accounts,Pakistan hints at adopting flexible exchange rate, OPEC scrapped its planned meeting in April, effectively extending supply cuts,Commerªcial use of the electrªicity producªed will start from June,PRF enables govt in accelerating delivery of critical infrastructure across the province,The creation of data centres can help solve many problems that domestic iPhone users have encountered,New committees of public sector firms will comprise private sector experts
,Delegation seeks cooperation in areas of trade, energy and furniture,Is planning to ease burden on PSDP by seeking innovative financing,One plant will begin test production between March 20 and 25, second in late April,BOI chief  Haroon Sharif says industrial policy will reduce cost of doing business,The rupee has been continuously shedding its value for about a week now,Lender says four influential groups have frustrated efforts to bring reforms in country,Minister of State for Revenue Hammad Azhar says these people are under FBR?s watch list,During talks, IMF had demanded shift from a managed currency regime"
2019-03-20,"PTI govt asked to take industry?s input for trade deals,Private sector urged to submit budget proposals,NA panel warned of flash floods in summer,Fauji Fertiliser increases urea prices by Rs80 per bag,5G to establish foundation for digital economy,Elite capture costs Pakistan's economy Rs860 billion per year,Investment in human capital vital for development: Umar,Pakistan's federal govt asks provinces to share cost of subsidies,Imran Khan-led govt to reimburse inflated gas bills amounting Rs2.5b, FCCI chief calls for appointing Pakistan consul general in New York,Speakers stress inter-departmental coordination to avoid double taxation,Secretary seeks allocation of Rs15b for flood protection project,Increase comes on the back of expected rise in demand amid low inventory,World Bank says delay in 5G deployment will put off revolutionary leap,Asad Umar believes open, rule-based economy can break elite stranglehold,Finance minister says govt is improving structure to strengthen institutions
,Also proposes the setting up of fund for security-related expenses,Information Minister Fawad Chaudhry observes at least 3.2m consumers were affected by overcharging"
2019-03-21,"Funds for CPEC designated for development schemes,SBP reserves surge 8.8% to stand at $8.84b,Market watch: KSE-100 continues to lose ground amid lack of triggers,Oil slips but holds near 2019 peak as supplies tighten,PRA shares progress with IMF team ÿÿ,France keen to enhance assistance ÿÿ,Rupee stable against dollarÿÿ,PTI govt sacks SNGPL chief over inflated gas bills,Credit Suisse-led consortium chosen as financial advisers,NBP inaugurates second facility to boost remittances,Pakistan?s auto industry capacity to reach 600,000 cars by 2021,?Now is the time to capture the global textile market?,Younus Dagha appointed finance secretary,ECC approves Rs17.5 billion supplementary budget,Careem, Uber barred from entry to Karachi's Jinnah International Airport, A total of 480 schemes had been initiated out of which 110 are still incomplete,Increase comes on the back of inflows from UAE,Benchmark index decreases 163.04 points to settle at 38,384.72,Crude prices have risen by almost a third since the start of 2019 due to OPEC-led supply cuts,IMF team appreciated PRA?s efforts in promoting ease of doing business ,The envoy shared that the current portfolio of financial assistance amounted to ?800-900 million,Cumulatively, the rupee has lost 31.8% of its value in the last 13 months,Gas utility?s board gives additional charge of MD to Mahmood Ahmad Zia,Will provide advisory facility for privatisation transactions of two power plants,Aims to encourage inflows through legal channels to combat money laundering,Official urges govt to adopt wholesale-retail mechanism to increase efficiency of sector,Commerce adviser says govt has finalised policy for value addition of sector,Govt employs Dagha to tackle fiscal challenges, negotiate with IMF,Also freezes, in principle, payments worth Rs96b that PIA owes to CAA,The ruling will be in effect till both companies meet the legal requirements of Sindh Transport Authority"
2019-03-22,"Market watch: KSE-100 turns bullish as investors cherish Chinese loan,Trump says trade deal with China likely,Oil slips further from 2019 highs on trade worries,China to lend Pakistan $2.1b in commercial loan next week,Sinotruk expands product range to benefit from CPEC,Prudent policies help Pakistan's textile sector pick up pace,Pakistan's Agri-committee to set crop targets in mid-April,Mobile payment growth sparks fall in bank terminals,Pakistan?s changing e-commerce landscape,Qatar agrees to increase LNG export to Pakistan,Top court's ruling in Bahria Town case lifts business sentiments,CPEC likely to contribute 3.5% to Pakistan?s GDP,Pakistan eyes Far East markets via Malaysia,PTI govt clears Rs80b project for CPEC?s western route, Benchmark index increases 147.15 points to settle at 38,531.87,US president expects to keep 25% tariff on European light trucks,Prices, however, find support from OPEC-led supply cuts, US sanctions,The Ministry of Finance has completed all procedural formalities with the Chinese counterpart for the facility,Chinese truckmaker introduces six new models with Euro-3 engine technology, LPG fuel option,Textile sector would assist in surpassing the overall export target of $25 billion by the end of current fiscal year,Bank representatives will discuss credit flow during sowing season,Number of ATMs dropped by 17,800 quarter-on-quarter by the end of 2018,Online marketplace sets up logistics firm to facilitate sellers, boost deliveries,ECC likely to approve additional import of 200 mmcfd from Qatar,Businessmen see dividends for all stakeholders,Early harvest projects are expected to be completed in current calendar year,Malaysian PM arrives to red carpet welcome in Islamabad,Clearance comes amid difficulties in arranging funds for new schemes due to paucity of resources"
2019-03-23,"Govt considering fixed tax on traders,SPI declines 0.19%ÿ,?Pakistan can become economic leader?ÿÿ,Govt looking to revive Pakistan Textile City,Legislation for PM housing scheme finalised,Gold touches new peak at Rs70,300 per tola,Dawood calls for exploiting trillion-dollar halal food market,Imran proposes strategic alliance to combat Islamophobia,Rupee hits record low at 140.24 against US dollar,Foreign loan disbursements slow down to $2.8b, Hammad Azhar urges businessmen to submit relevant proposals,Average prices of 22 items rose in a selected basket of goods,Economic situation would get better once the ease of doing business improved in the country,Textile Division submits summary, business plan to Prime Minister?s Office,Prime minister to perform groundbreaking of the project in April,This comes despite fall in global commodity market,Says Pakistan, Malaysia should work jointly to tap the potential,Pakistan, Malaysia PMs hold wide-ranging talks,Experts say latest depreciation is in line with expectations,Decline in inflows highlights govt?s inability to remove bottlenecks"
2019-03-24,"South Korea accepts over 15,000 job applications from Pakistan,Visual discovery start-up Pinterest files for IPO,Master Motor to start assembling pickups and vans in April,Importers demand time to implement new conditions set by PTI govt,Japan seeks stronger bonds with Pakistan,After six weeks of decline, KSE-100 gains 225 points,Italy endorses China?s Belt and Road plan in first for a G7 nation,Pakistani tyre manufacturers develop strategy to compete globally,PTI govt required to pay Rs1 billion to oil pipeline company,World Bank downgrades rating of Punjab project, South Korea also increases Pakistani labour quota from 900 to 1,000 per year,Expects to seek a valuation of around $12 billion,The $100-million venture also aims to assemble SUV in future,Request govt to give 6-8 months to comply with shelf life, labeling requirements,Ambassador Matsuda names sports, culture and education as sectors of interest,News of inflows from China, MoUs with Malaysia and improved current account deficit drive sentiments,Rapprochement angers Washington, alarms some EU allies,Businesses forced to diversify amid sanctions on some export markets
,Asia Petroleum Limited seeks payment to cover shortfall in furnace oil supply,Move comes due to provincial government?s failure to approve a spatial strategy"
2019-03-25,"Market watch: Weak global economic outlook prompts sell-off in Pakistan's market,Oil prices hit by worries of sharp economic slowdown,China deposits $2.2 billion in SBP reserves,EU completes no-deal Brexit preparations,Asia's largest oil, gas reserves may soon be found near Karachi: PM,Parthenium - the silent killer of Pakistan?s agricultural yield,Holding company for state-owned enterprises restructuring may be self-defeating approach,Pakistani cherries rival Chilean counterparts, yet hard to enter Chinese market,If China can eradicate poverty using ICT, why can?t we?, Benchmark index decreases 403.21 points to settle at 38,128.66,Concerns about potential US recession emerge after remarks by Federal Reserve,Much-needed inflows will help Islamabad make international payments,Expects United Kingdom to leave the European Union without a deal on 12 April,India can carry out terrorist attack in Pakistan before next month's elections: PM tells journalists,In recent years, it has infested sugarcane, cotton, vegetable and other crops
,Accumulated debt of 200 public enterprises has now surpassed Rs1 trillion mark

,Officials discuss hurdles and other issues facing the fruit?s export to China,Pakistan needs to invest a lot in ICT infrastructure like optic fibres, mobile towers"
2019-03-26,"Govt to recover deficit of Rs200b from power consumers,Market watch: KSE-100 recovers 200 points as investors cheer China's assistance,Oil up near $68 as supply cuts outweigh economic worry,Uber to acquire rival Careem for $3.1 billion,PIA working to start direct Faisalabad-Jeddah flights,Major stakeholders reject sowing of GM corn seeds,Pak Suzuki Motor?s profit drops 66% to Rs1.3b,World Bank advises Pakistan to set currency free of state control,Balochistan to get huge share in next Public Sector Development Programme,SBP cuts economic growth forecast to 3.5-4%,ECC may allow Bahria Foundation to set up LNG terminal,Pakistan remains firm, IMF changes its stance: Umar,After FATF, APG may also grey-list Pakistan,Meeting with Taliban cancelled due to objections by Afghan govt, says PM Imran, Power minister says entire burden will not be transferred in one go,Benchmark index increases 0.53% to settle at 38,329.13,Expectations of a further drop in US inventories support prices,After takeover, Careem will become wholly owned subsidiary of Uber,Allocates 1.5 tons of cargo quota for Faisalabad-Karachi flights,They see no significant increase in yield, cut in production cost,Decline comes on back of rupee weakness which dented company margins,World Bank notes that rupee-dollar exchange rate should be based on market system,Prime Minister Imran Khan would shortly visit Balochistan to make a big announcement for the province,Revises projection due to slowdown in agricultural growth, stabilisation measures,Country needs one more gas terminal in view of growing demand,Finance minister says bailout deal likely at the end of IMF?s staff-level mission
,Group?s delegation arrives in Islamabad to conduct last on-site mutual evaluation,Imran proposes interim setup in Afghanistan"
2019-03-27,"Market watch: KSE-100 surges over 600 points as clarity emerges in IMF talks,Oil prices slip as market eyes US inventories,Contract signed for work on Mohmand Dam project,Pakistan keen on better ties with Kazakhstanÿ,Apparel park declared special zoneÿ,Rupee weakens against dollarÿÿ,Pakistani exporters invited to Milan fashion expo,Lafayette eyes $1.13b revenue in China,Govt to promote tourism as national cause: Zulfi Bukhari,Chinese envoy for boosting economic, commercial ties,SME policy to be finalised before mid-April,Pakistan, IMF finalising elements of bailout memo,Government acknowledges mistake in gas slab revision,Pakistan?s financing needs may hit $50b in next 2 years, Benchmark index increases 1.66% to settle at 38,965.01,Brent crude has traded in a narrow range of $64 to $69 a barrel throughout March,'Dam would play the role of a catalyst in stabilising the national economy','Government had introduced investment-friendly policies in the country from which Kazakh investors could benefit',Assured the business community of government?s full support,Cumulatively, the rupee has lost 31.8% of its value in the last 13 months,Textile industry asked to seek assistance of Italian experts,French department store chain plans to open about 10 stores,Is framing short, long-term plans to boost tourism, will revamp PTDC,Says more cooperation between private sectors of two sides will lower manufacturing cost,PM aide stresses no utility store will be closed, no employee will be sacked
,Asad Umar meets IMF?s new Mission Chief Ernesto Ramirez,Minister says no decision taken on returning excess money to consumers who received inflated bills,Shahid Kardar says IMF financing will not be that big to meet requirement"
2019-03-28,"Privatisation of two power plants expected to fetch $2 billion,As pressure grows, Turkish lira plunges against dollar,Oil prices inch down as US crude stocks climb,PPRA refuses to award contract without competitive bidding,Punjab to launch youth loan scheme in April,Rashakai SEZ to get $128m initial investment,Pakistan's wheat production likely to hit five-year low,Zero-rated units in Karachi complain of being over-charged,PTI govt shelves plan of relocating LNG terminals,In summers: PTI govt hopes power supply across Pakistan will increase,FBR recovers Rs13.5 billion from tax dodgers,IMF mission chief meets SBP governor ahead of monetary policy,Ignoring cheaper offer, ECC goes for Qatar LNG, 90pc of this amount will be used for debt payment, the rest on poverty alleviation,Currency weighed down by concerns over Turkey's balance of payments, foreign debt,US inventories rose last week by 2.8 million barrels,PPRA turns down IFC?s offer for advisory services for sale of two LNG-fired power plants
,Maximum limit of loans will be Rs3m; women will be given preference,Rashakai SEZ is the first of the 9 identified SEZs under the China-Pakistan Economic Corridor (CPEC),Output may be 24.8m tons against target of 25.6m tons as cultivated area shrinks,K-Electric says it is waiting for directives from the Power Division,Ministry of Maritime Affairs wanted to shift terminals due to congestion at Port Qasim,Power Division says 90% of constraints on transmission lines addressed,Its enforcement, tax net widening drives pick up pace amid criticism
,Timing of meeting crucial as central bank is to announce interest rate on Friday,Economic Coordination Committee extends deadline for preparing revival plan for PSM"
2019-03-29,"Market watch: KSE-100 gains 96 points as uncertainty grips market,Oil set for biggest quarterly rise since 2009,US, China hold constructive trade talks in Beijing,SBP jacks up key interest rate by 50bps to 10.75%,Petrol rates likely to go up by Rs12,FBR extends office hours to facilitate taxpayers,Chinese firm intends to establish modern garment factory in Pakistan,Capital Group expresses interest in Pakistan market,Shanghai Electric interested in expanding investment in Pakistan,Pakistan moves to recapture Afghanistan?s wheat market,Imran Khan-led govt approves land acquisition cost for Kuchlak-Zhob road,PTI govt irked by delay in finalising LNG terminal site,FBR official reveals reasons for revenue shortfall,Senate panel expects Rs120b tax collection from cigarette industry,State Bank of Pakistan's interest rate decision may catch experts by surprise,Talks with APG conclude, Benchmark index increases 0.25% to settle at 38,649.34,OPEC-led production cut lends support to prices,Mnuchin, Lighthizer hold face-to-face meetings in Chinese capital,Central bank says decision taken due to hike in POL prices, mounting fiscal deficit,Ogra sends summary to Petroleum Division recommending hike in oil prices for April 2019,Office timings extended for Friday and Saturday ,Chinese Ambassador to Pakistan Yao Jing insists this investment will create thousands of jobs in Pakistan,Delegation official says improved security situation, govt policies have sparked interest,Vice chief economist says investment in K-Electric is just the beginning,Plans to open Torkham border for 24 hours a day for exports by August this year,Planning Division gives presentation on doubling tracks of western alignment,Delay caused by previous government?s move to scrap bidding allegedly in favour of one company
,Stresses authority is determined to bring potential taxpayers in the tax net,Believes scrapping of third tax tier will help enhance revenue receipts,Many research houses anticipate rise in policy rate while others expect no change,FATF expressed dissatisfaction over the steps taken against banned organisations and terror-funding"
2019-03-30,"SBP reserves fall 3.14% to $8.56bÿÿÿÿ,Egyptian business team to arrive in May,NA committee briefed about loan schemes for women,BOP running without president for four months,Dawood appointed CPEC Business Council chairman,IMF team to arrive in Pakistan on April 1, Senate body told,NFC moot fails to smooth over sticking points,Govt directs PSO to use rail for fuel transportation,Rupee falls as country prepares for IMF deal,New tax body set up for assets stashed abroad, On March 25, 2019, the SBP received RMB 15 billion equivalent to $2.2 billion as proceeds of a loan,Will explore trade and investment opportunities in Pakistan,ZTBL president says Rs0.2m per borrower is being given under Rozgar scheme,The Bank of Punjab has not been able to appoint a permanent president thus far,Decision may stir controversy as earlier it was decided planning minister will be the head,Will review working and methodologies of Pakistan Bureau of Statistics,Asad Umar says efforts under way to complete process of 9th NFC award by Dec 31,Railways offers 26% lower fares compared to oil supply via pipeline and road,Weakens to 142.50 against the US dollar in open market,FBR also notifies setting up of two other directorates"
